[
  {
    "ability_id": "matchless-swiftness",
    "name": "Matchless Swiftness",
    "authored_by": "40kdc-community",
    "game_version": {
      "edition": "11th",
      "dataslate": "pre-launch-provisional"
    },
    "version": "2025-q3",
    "effect": {
      "type": "stat-modifier",
      "target": "unit",
      "modifier": {
        "stat": "M",
        "operation": "add",
        "value": 8
      }
    },
    "scope": {
      "range": "unit",
      "duration": "phase"
    },
    "unit_ids": [
      "reavers"
    ],
    "ability_type": "unit",
    "behavior": "passive"
  },
  {
    "ability_id": "eviscerating-fly-by",
    "name": "Eviscerating Fly‑by",
    "authored_by": "40kdc-community",
    "game_version": {
      "edition": "11th",
      "dataslate": "pre-launch-provisional"
    },
    "version": "2025-q3",
    "effect": {
      "type": "mortal-wounds",
      "target": "defender",
      "modifier": {
        "count": "1"
      }
    },
    "scope": {
      "range": "unit",
      "duration": "permanent"
    },
    "unit_ids": [
      "reavers"
    ],
    "ability_type": "unit",
    "behavior": "passive"
  },
  {
    "ability_id": "cluster-caltrops",
    "name": "Cluster caltrops",
    "authored_by": "40kdc-community",
    "game_version": {
      "edition": "11th",
      "dataslate": "pre-launch-provisional"
    },
    "version": "2025-q3",
    "effect": {
      "type": "stat-modifier",
      "target": "unit",
      "modifier": {}
    },
    "scope": {
      "range": "unit",
      "duration": "permanent"
    },
    "unit_ids": [
      "reavers"
    ],
    "ability_type": "unit",
    "behavior": "passive",
    "community_notes": "auto-generated stub — needs manual authoring (source: 10e Datasheets_abilities; rules text omitted for IP)"
  },
  {
    "ability_id": "grav-talon",
    "name": "Grav-talon",
    "authored_by": "40kdc-community",
    "game_version": {
      "edition": "11th",
      "dataslate": "pre-launch-provisional"
    },
    "version": "2025-q3",
    "effect": {
      "type": "keyword-grant",
      "target": "unit",
      "modifier": {
        "keywords": [
          "Lethal Hits"
        ]
      }
    },
    "scope": {
      "range": "unit",
      "duration": "permanent"
    },
    "unit_ids": [
      "reavers"
    ],
    "ability_type": "unit",
    "behavior": "passive"
  },
  {
    "ability_id": "deadly-demise-1",
    "name": "Deadly Demise 1",
    "authored_by": "40kdc-community",
    "game_version": {
      "edition": "11th",
      "dataslate": "pre-launch-provisional"
    },
    "version": "2025-q3",
    "effect": {
      "type": "conditional",
      "condition": {
        "type": "timing-is",
        "parameters": {
          "timing": "before-bearer-removed"
        }
      },
      "effect": {
        "type": "dice-gated",
        "dice": "D6",
        "threshold": 6,
        "comparison": "gte",
        "on_success": {
          "type": "mortal-wounds",
          "target": "enemy-within-aura",
          "modifier": {
            "count": "1",
            "range": 6
          }
        },
        "on_fail": null
      }
    },
    "scope": {
      "range": "aura-6",
      "duration": "permanent"
    },
    "unit_ids": [
      "cronos"
    ],
    "ability_type": "core",
    "behavior": "reactive"
  },
  {
    "ability_id": "feel-no-pain-5",
    "name": "Feel No Pain 5+",
    "authored_by": "40kdc-community",
    "game_version": {
      "edition": "11th",
      "dataslate": "pre-launch-provisional"
    },
    "version": "2025-q3",
    "effect": {
      "type": "feel-no-pain",
      "target": "unit",
      "modifier": {
        "threshold": 5
      }
    },
    "scope": {
      "range": "unit",
      "duration": "permanent"
    },
    "unit_ids": [
      "cronos"
    ],
    "ability_type": "core",
    "behavior": "passive"
  },
  {
    "ability_id": "pain-parasite",
    "name": "Pain Parasite",
    "authored_by": "40kdc-community",
    "game_version": {
      "edition": "11th",
      "dataslate": "pre-launch-provisional"
    },
    "version": "2025-q3",
    "effect": {
      "type": "conditional",
      "condition": {
        "operator": "and",
        "operands": [
          {
            "type": "phase-is",
            "parameters": {
              "phase": "fight"
            }
          },
          {
            "type": "unit-below-starting-strength"
          }
        ]
      },
      "effect": {
        "type": "sequence",
        "steps": [
          {
            "type": "fight-on-death",
            "target": "self",
            "modifier": {}
          },
          {
            "type": "shoot-on-death",
            "target": "self",
            "modifier": {}
          }
        ]
      }
    },
    "scope": {
      "range": "unit",
      "duration": "permanent"
    },
    "unit_ids": [
      "cronos"
    ],
    "ability_type": "unit",
    "behavior": "passive",
    "community_notes": "auto-generated, partial"
  },
  {
    "ability_id": "pain-engine-aura",
    "name": "Pain Engine (Aura)",
    "authored_by": "40kdc-community",
    "game_version": {
      "edition": "11th",
      "dataslate": "pre-launch-provisional"
    },
    "version": "2025-q3",
    "effect": {
      "type": "ability-grant",
      "target": "self",
      "modifier": {
        "ability_id": "flavor-text"
      }
    },
    "scope": {
      "range": "aura-9",
      "duration": "permanent"
    },
    "unit_ids": [
      "cronos"
    ],
    "ability_type": "unit",
    "behavior": "passive"
  },
  {
    "ability_id": "leader",
    "name": "Leader",
    "authored_by": "40kdc-community",
    "game_version": {
      "edition": "11th",
      "dataslate": "pre-launch-provisional"
    },
    "version": "2025-q3",
    "effect": {
      "type": "ability-grant",
      "target": "unit",
      "modifier": {
        "ability_id": "leader"
      }
    },
    "scope": {
      "range": "attached",
      "duration": "permanent"
    },
    "unit_ids": [
      "succubus"
    ],
    "ability_type": "core",
    "behavior": "passive"
  },
  {
    "ability_id": "lithe-agility",
    "name": "Lithe Agility",
    "authored_by": "40kdc-community",
    "game_version": {
      "edition": "11th",
      "dataslate": "pre-launch-provisional"
    },
    "version": "2025-q3",
    "effect": {
      "type": "re-roll",
      "target": "unit",
      "modifier": {
        "roll": "charge",
        "subset": "all-failures"
      }
    },
    "scope": {
      "range": "unit",
      "duration": "permanent"
    },
    "unit_ids": [
      "succubus"
    ],
    "ability_type": "unit",
    "behavior": "passive"
  },
  {
    "ability_id": "storm-of-blades",
    "name": "Storm of Blades",
    "authored_by": "40kdc-community",
    "game_version": {
      "edition": "11th",
      "dataslate": "pre-launch-provisional"
    },
    "version": "2025-q3",
    "effect": {
      "type": "conditional",
      "condition": {
        "type": "is-attached"
      },
      "effect": {
        "type": "keyword-grant",
        "target": "unit",
        "modifier": {
          "keywords": [
            "Sustained Hits 1"
          ]
        }
      }
    },
    "scope": {
      "range": "unit",
      "duration": "permanent"
    },
    "unit_ids": [
      "succubus"
    ],
    "ability_type": "unit",
    "behavior": "passive"
  },
  {
    "ability_id": "bloody-spectacle",
    "name": "Bloody Spectacle",
    "authored_by": "40kdc-community",
    "game_version": {
      "edition": "11th",
      "dataslate": "pre-launch-provisional"
    },
    "version": "2025-q3",
    "effect": {
      "type": "conditional",
      "condition": {
        "operator": "and",
        "operands": [
          {
            "type": "phase-is",
            "parameters": {
              "phase": "fight"
            }
          },
          {
            "type": "target-has-keyword",
            "parameters": {
              "keyword": "CHARACTER"
            }
          }
        ]
      },
      "effect": {
        "type": "sequence",
        "steps": [
          {
            "type": "re-roll",
            "target": "unit",
            "modifier": {
              "roll": "hit",
              "subset": "all-failures"
            }
          },
          {
            "type": "re-roll",
            "target": "unit",
            "modifier": {
              "roll": "wound",
              "subset": "all-failures"
            }
          }
        ]
      }
    },
    "scope": {
      "range": "unit",
      "duration": "permanent"
    },
    "unit_ids": [
      "succubus"
    ],
    "ability_type": "unit",
    "behavior": "passive",
    "community_notes": "auto-generated, partial"
  },
  {
    "ability_id": "deep-strike",
    "name": "Deep Strike",
    "authored_by": "40kdc-community",
    "game_version": {
      "edition": "11th",
      "dataslate": "pre-launch-provisional"
    },
    "version": "2025-q3",
    "effect": {
      "type": "deep-strike",
      "target": "unit",
      "modifier": {}
    },
    "scope": {
      "range": "unit",
      "duration": "permanent"
    },
    "unit_ids": [
      "hellions",
      "reaper"
    ],
    "ability_type": "core",
    "behavior": "activated"
  },
  {
    "ability_id": "battlefield-butchery",
    "name": "Battlefield Butchery",
    "authored_by": "40kdc-community",
    "game_version": {
      "edition": "11th",
      "dataslate": "pre-launch-provisional"
    },
    "version": "2025-q3",
    "effect": {
      "type": "conditional",
      "condition": {
        "type": "phase-is",
        "parameters": {
          "phase": "fight"
        }
      },
      "effect": {
        "type": "stat-modifier",
        "target": "unit",
        "modifier": {
          "stat": "S",
          "operation": "add",
          "value": 1
        }
      }
    },
    "scope": {
      "range": "unit",
      "duration": "permanent"
    },
    "unit_ids": [
      "hellions"
    ],
    "ability_type": "unit",
    "behavior": "passive"
  },
  {
    "ability_id": "skyboard-evasion",